nom_produit,prix,categorie,note
"Crème anti rides yeux avec de l'huile de rose, huile d'avocat et Q10, 15 ml","10,15€",Cosmétique et Beauté,"3,6"
H&B Crème Puissante Anti-Rides 50 ml,"28,00€",Cosmétique et Beauté,"3,9"
Sérum primer maquillage pour feuille d'or 24k Base de maquillage anti-rides anti-âge Minimizer Pores,"9,98€",Cosmétique et Beauté,"5,0"
Firming Concentré pour le corps et le buste 250 ml,"52,86€",Cosmétique et Beauté,N/A
"Elizabeth Arden Advanced Light Ceramide Capsules, Sérum Perfecteur Raffermissant, texture ultra-légère","92,00€",Cosmétique et Beauté,"4,6"
"Sérum anti-âge visage, cou et décolleté à l'acide hyaluronique, à la myrtille et aux peptides Botox-Like. Anti-rides, éclairant et liftant 30 ml","44,99€",Cosmétique et Beauté,N/A
Anti-âge Crème avec acide hyaluronique et Caviar,"9,95€",Cosmétique et Beauté,N/A
"BeautyLab‿Complexe contour des yeux anti-âge Renouvellement instantané - Restaure la fermeté, améliore les rides et ridules, 15 ml","41,04€",Cosmétique et Beauté,"3,7"
"Pompe de Fondation,2 pièces Tête de Distribution de Rechange Ensemble de Pompe de Fondation en Plastique pour la Fondation Estee Lauder Double Wear","8,99€",Cosmétique et Beauté,"4,6"
