nom_produit,prix,categorie,note
Clinique Superbalanced Fond de Teint Liquide Équilibre Parfait | Équilibre les zones sèches et grasses du visage,"36,75€",Cosmétique et Beauté,"4,6"
Erborian - CC Red Correct Crème Teintée Anti-Rougeur - Soin du Visage Perfecteur Automatique de Teint avec Correction Colorielle - Teint Unifié - SPF 25 - Cosmétique Coréen,"15,89€",Cosmétique et Beauté,"4,5"
"IT Cosmetics CC+ Crème, Fond de Teint Haute Couvrance SPF 50, Correcteur de Teint & Sérum Anti-Âge","41,50€",Cosmétique et Beauté,"4,3"
"Pompe de Fondation,2 pièces Tête de Distribution de Rechange Ensemble de Pompe de Fondation en Plastique pour la Fondation Estee Lauder Double Wear","8,99€",Cosmétique et Beauté,"4,6"
"3pcs Pompes de Fond de Teint de Rechange, Changeur de Pompe de Maquillage, Pompes de Fond de Teint de Rechange, Doré","6,99€",Cosmétique et Beauté,"3,8"
Gisèle Denis Color Facial Sunscreen Spf50+ Medium/Dark 40ml,"18,00€",Cosmétique et Beauté,N/A
"Elizabeth Arden Coffret Lissant Retinol, Rétinol + HPR Ceramide 90 Capsules Sérums, Aqua-Crème Régénérante, Crème Contour des Yeux, Cadeau femme, Soin hydratant, Anti-âge","83,55€",Cosmétique et Beauté,"4,5"
Este Blush Stick multi-usage Dusty Rose Ltd Edition Lauder,"24,31€",Cosmétique et Beauté,N/A
MASUNN Pompe de fondation de remplacement la fondation Compatible avec Estee Lauder Double Wear/M.A.C,"7,90€",Cosmétique et Beauté,"4,6"
"Elizabeth Arden ADVANCED Ceramide Crème Contour des Yeux Liftante et Raffermissante (15 ml), Anti Rides Femme, Crème Hydratante Anti-Âge","39,66€",Cosmétique et Beauté,"4,4"
"Lot de 4 Pompes de Fond de Teint de Rechange, compatibles avec Les Fonds de Teint Double Wear Mac et Estée Lauder, Changeur de Pompe de Maquillage (avec Cuillère, Pipette, Entonnoir)","12,99€",Cosmétique et Beauté,"4,4"
"Maybelline New York Foundation Superstay Active Wear Fond de teint liquide longue durée 30 heures – Sensation légère – Résistant à l'eau, à la transpiration et aux transferts – 30 ml – Teinte : 03 –","14,93€",Cosmétique et Beauté,"4,2"
"Elizabeth Arden Ceramide Premiere, Crème de Nuit Hydratante et Régénérante pour Visage, Hydratation Intense","76,43€",Cosmétique et Beauté,"4,3"
Total Control Drop Foundation Soft Beige,"8,65€",Cosmétique et Beauté,"4,1"
"Crème Contour des Yeux Anti-Rides,Soins de Nuit Anti-Poches et Anti-Cernes,Hydratation Profonde,à l'Acide Hyaluronique et au Miel des Alpes & Centella,Fabriqué en France-15ML","21,60€",Cosmétique et Beauté,"3,6"
Laura Geller Baked Blush-n-Brighten 5g Sunswept,"24,73€",Cosmétique et Beauté,"4,5"
BIODERMA Créaline défensive sérum - Réduit rides et ridules - Agit contre l’inflamm’aging causé par les agressions extérieures - Pour un teint éclatant - Flacon 30 ml,"22,20€",Cosmétique et Beauté,"5,0"
L'OCCITANE - Crème Visage Ultra Riche Karité - Peaux sèches et sensibles - 50 ml - Hydratant - Fabriqué en France,"36,00€",Cosmétique et Beauté,"4,6"
Paula's Choice CALM Sérum Réparateur - Sérum Acide Hyaluronique Hydrate & Apaise les Rougeurs - Peaux Sujettes à la Rosacée - avec Acide Hyaluronique & Céramides - Tous Types de Peaux - 30 ml,"53,00€",Cosmétique et Beauté,"4,6"
Missha Time Revolution Night Repair Probio Ampoule Cream 50ml / 1.69 FL.OZ,"27,90€",Cosmétique et Beauté,"4,4"
"Bumble and bumble. Creme De Coco Shampooing ultra hydratant | Shampooing nourrissant & anti-frisottis | Hydratation & brillance intense | Cheveux bouclés, ondulés, lisses, 250 ml","33,39€",Cosmétique et Beauté,"4,6"
"Collection Cosmetics Lasting Perfection Glow Fond de teint couvrance moyenne à complète, 27 ml, moka foncé","10,79€",Cosmétique et Beauté,"4,2"
Contorno De Ojo Crema Anti-Ojeras Con Aciano - 15 Ml,"5,84€",Cosmétique et Beauté,"4,3"
Creme-Stiftung - Fluid Foundation,"32,17€",Cosmétique et Beauté,"3,5"
"ALKEMY Crème Contour des Yeux anti Rides et Hydratante, effet Lifting yeux fatigués, contre Poche, Cerne avec Acide Hyaluronique et Argireline, Testée Dermatologiquement, Cosmétique Naturelle - 15 ml","39,90€",Cosmétique et Beauté,"5,0"
"Elizabeth Arden - Flawless Finish Sponge-On Cream Makeup, Fini Lumineux et Lisse Sans Imperfections, Poudre de Diamant et Microsphères, Fond de Teint Crème Compact Haute Couvrance","46,00€",Cosmétique et Beauté,"4,5"
"Face D | Instant Rich, Crème Anti-âge pour le Visage et Cou avec Acide Hyaluronique et Vitamine E, 50 ml","34,00€",Cosmétique et Beauté,"4,5"
ELIZABETH ARDEN Visible Difference Base Perfectrice de Peau 15 ml,"25,00€",Cosmétique et Beauté,"4,3"
"Huile Visage Anti-Âge au Miel des Alpes,Soin Nourrissant & Équilibrant à l'Huile de Lavande Papillon – Sérum de Nuit Réparateur,Anti-Ridules et Éclat – Texture Sèche,Fabriqué en France–30ml","43,60€",Cosmétique et Beauté,"4,5"
Crème de nuit visage Anti-âge - BIO,"26,40€",Cosmétique et Beauté,"3,9"
Stick déodorant anti-transpirant pour femme DKNY Cashmere Mist - 50 ml,"69,95€",Cosmétique et Beauté,"4,5"
"Uriage Age Absolu Crème Anti-Rides - Rétinol, Acide Hyaluronique, Vitamine C & E - Booster Procollagène x6 - Rides, Relâchement - Volume & Hydratation - Velouté Eclat - Brevet Anti-âge Exclusif 50ml","39,33€",Cosmétique et Beauté,"4,5"
"Spilanthox therapy - Ultra Rich Eye-Lifting Fluid - Soin anti-âge des yeux pour un contour des yeux lisse - Spilanthol, acide hyaluronique & aloe vera - anti-âge - cosmétique naturel - 15ml","27,95€",Cosmétique et Beauté,"4,2"
Beauty Glazed Antiadhésif 12 Couleurs Mat Rouge à Lèvres Nude Ensemble,"13,88€",Cosmétique et Beauté,"4,4"
"Crème serrant pour les yeux, Crème anti-vieillissement pour les yeux pour réduire les sacs aux yeux, les rides, les lignes fines - hydratant et apaisant pour tous les types de peau","9,99€",Cosmétique et Beauté,"3,4"
Beauty Queens - Estee Lauder [Import allemand],"9,75€",Cosmétique et Beauté,N/A
"Institut Esthederm - Intensive Hyaluronic - Crème Anti Rides et Ridules - Lutte contre la Déshydratation, les Tiraillements - Pour une Peau Repulpée et Hydratée en Profondeur - Pot de 50 ml","46,99€",Cosmétique et Beauté,"4,4"
Pleasures Intense Ep 100 Vp,"193,82€",Cosmétique et Beauté,N/A
FREDERIC MALLE Musc Ravageur Eau De Parfum 30 ml,"140,01€",Cosmétique et Beauté,"3,3"
Labial Bittersweet Matte Me Sleek,"6,45€",Cosmétique et Beauté,"4,3"
AFFICHE - Estée LAUDER - yPure Color Envy - 120x175cm - AFFICHE / POSTER,N/A,Cosmétique et Beauté,N/A
"3 PCS Têtes de Pompe de Fond de Teint Dorée, Pompe de Remplacement pour Fond de Teint Liquide, Tête de Pompe de Distribution pour Flacon de Fond de Teint Estee Lauder D.W, Tête de Pompe de Maquillage","12,98€",Cosmétique et Beauté,"5,0"
"Face D | Crème Visage Raffermissante Antipollution à l'Acide Hyaluronique, Vitamine E et SPF15, 50 ml","26,40€",Cosmétique et Beauté,"4,3"
FREDERIC MALLE Eau De Magnolia Eau De Toilette Travel Spray Refill 10 ml,"56,43€",Cosmétique et Beauté,N/A
"Luxeveria Serum Anti Ride, Hydratant, Estaure 'Éclat Jeunesse, Reduit les Signes, Visibles du Vieillissement 30ml (1 bouteille)","15,99€",Cosmétique et Beauté,"5,0"
"Pompe de fond de teint de rechange MELTU, dorée, compatible avec fond de teint double usure Estee Lauder","11,30€",Cosmétique et Beauté,"4,5"
"Elizabeth Arden Flawless Finish, Fond de Teint Soin, Acide Hyaluronique, Vitamine C & E, Couvrance Longue Durée","19,04€",Cosmétique et Beauté,"4,3"
Dark Divine 200. Brun,N/A,Cosmétique et Beauté,"4,4"
"Kelemata Collagen Intensive, Concentré Anti-rides Raffermissant, 30 ml","13,99€",Cosmétique et Beauté,"4,5"
Pompe De Fondation De Remplacement En Or Pour La Fondation Double Wear Estee Lauder,"4,14€",Cosmétique et Beauté,N/A
"Lot de 2 pompes de fond de teint de rechange pour Estee Lauder, pompe de fond de teint de rechange compatible avec fond de teint double usure Estee Lauder (doré)","21,10€",Cosmétique et Beauté,"4,6"
CCChaRLes Pompe Gold Replacement Foundation Pour Estee Lauder Double Wear Foundation,"11,99€",Cosmétique et Beauté,"4,7"
"e.l.f. Lash 'N Roll Mascara à friser, soulève et sépare les cils, formule durable, végétalien et sans cruauté, marron foncé, 9,2 g",N/A,Cosmétique et Beauté,"4,4"
"OULAC Métallique Briller Rouge à Lèvres, Rouge a Levre Nude Pêche Pailleté à Haut Pigment, Formule Hydratante, Brillant à Lèvres Couvrant Toute la Surface, Vegan 4,3g, Pure Envy(07)","6,99€",Cosmétique et Beauté,"4,1"
"Pompe de Rechange pour Fond de Teint Estée Lauder (1 pièce), Compatible avec Le Fond de Teint Estée Lauder Double Wear - Transparent","14,69€",Cosmétique et Beauté,N/A
Dr Pierre Ricaud Masque Visage Anti-Rides Lissant Express à l'Acide Hyaluronique & Galanga Bio - Soin du Visage pour Femme Anti Âge & Anti Rides - 50ml,"25,90€",Cosmétique et Beauté,"4,5"
"Magnetic Eyeliner,Magnetische Wimpern,Künstliche Magnetische Wimpern,Huile pour cheveux par Ouai","32,00€",Cosmétique et Beauté,"4,6"
"Pompe de Fondation,2 pièces Tête de Distribution de Rechange Ensemble de Pompe de Fondation en Plastique pour la Fondation Estee Lauder Double Wear","8,99€",Cosmétique et Beauté,"4,6"
"Biotherm, Aquasource Total Eye Revitalizer, Gel Yeux Effet Froid, Hydratation & Éclat, Enrichi en Caféine & Vitamine C, Tous Types de Peau, 15 ml","23,31€",Cosmétique et Beauté,"4,3"
"Yepoda The Night Light, Crème Hydratante Apaisante et Purifiante de Nuit Sans Huile avec Aloe Vera, Armoise et Niacinamide, Crème Visage Végane Coréenne Hydratante pour Tous Types de Peau, 50 ml","26,00€",Cosmétique et Beauté,"4,6"
"Elizabeth Arden Coffret Trio Rétinol + HPR, Ceramide Aqua-Crème Régénérante, Capsules Sérum Rétinol + HPR, Contour des Yeux Retinol, Cadeau femme, Soin hydratant, Anti-âge","35,00€",Cosmétique et Beauté,"4,7"
"Elizabeth Arden - Coffret Lift Starter 3 Pièces, Advanced Ceramide Capsules Sérum, Advanced Ceramide Lift and Firm Crème Jour SPF 15 et Crème Contour des Yeux, Soins pour le Visage Format Voyage","35,00€",Cosmétique et Beauté,"2,0"
BIODERMA Créaline défensive sérum - Réduit rides et ridules - Agit contre l’inflamm’aging causé par les agressions extérieures - Pour un teint éclatant - Flacon 30 ml,"22,20€",Cosmétique et Beauté,"5,0"
"Uriage Age Absolu Crème Anti-Rides - Rétinol, Acide Hyaluronique, Vitamine C & E - Booster Procollagène x6 - Rides, Relâchement - Volume & Hydratation - Velouté Eclat - Brevet Anti-âge Exclusif 50ml","39,33€",Cosmétique et Beauté,"4,5"
Elizabeth Arden Ceramide- Fond de Teint Crème Liftant et Raffermissant - couvrance moyenne à totale - anti-âge et hydratant 30 ml,"43,36€",Cosmétique et Beauté,"4,5"
Creme-Stiftung - Fluid Foundation,"46,90€",Cosmétique et Beauté,"3,5"
"Lot de 2 pompes de fond de teint de rechange pour Estee Lauder, pompe de fond de teint de rechange compatible avec fond de teint double usure Estee Lauder (transparent)","12,56€",Cosmétique et Beauté,"4,6"
Plaque décorative en bois « Beauty is an Attitude » - Citation inspirante d'Estée Lauder pour décoration murale - 30 cm x 40 cm,"22,94€",Cosmétique et Beauté,N/A
Estée Lauder Fixe Creativando Appendiabiti Art Up Pop Rouge,"209,25€",Cosmétique et Beauté,N/A
La Mer Moisturizing Soft Cream 30 Ml,"297,69€",Cosmétique et Beauté,"4,6"
Creme-Stiftung - Fluid Foundation,"31,07€",Cosmétique et Beauté,"3,5"
L'Oréal Paris L'Oreal Paris Age Perfect Cell Renewal Midnight Eye Cream Crème contour des yeux riche en antioxydants pour traiter 8 signes du vieillissement Contient 100 ml (paquet de 200 ml chacun),"45,91€",Cosmétique et Beauté,"4,4"
"Pompe de fond de teint,2 pièces Pompe Gold Foundation DW Pompe de Fond de Teint de Rechange,Pompe De Remplacement pour Fond pour la Fondation Double Wear","7,99€",Cosmétique et Beauté,"4,5"
Lot de 2 pompes de rechange pour fond de teint et maquillage compatibles avec les bouteilles de fond de teint Estee Lauder compatible avec les bouteilles Mayblline et Mac,"22,65€",Cosmétique et Beauté,"3,9"
Elisir Hjdrata Filler Conc,"14,51€",Cosmétique et Beauté,"4,4"
"SANTE Naturkosmetik Radiant Care Fond de teint 05 beige neutre, végétalien avec peptides bio et huiles de qualité supérieure, pour une peau éclatante, formule nourrissante et durable, 30 ml","13,99€",Cosmétique et Beauté,"3,1"
"Biotherm, Aquasource Total Eye Revitalizer, Gel Yeux Effet Froid, Hydratation & Éclat, Enrichi en Caféine & Vitamine C, Tous Types de Peau, 15 ml","23,31€",Cosmétique et Beauté,"4,3"
"Magnetic Eyeliner,Magnetische Wimpern,Künstliche Magnetische Wimpern,Huile pour cheveux par Ouai","32,00€",Cosmétique et Beauté,"4,6"
"Yepoda The Night Light, Crème Hydratante Apaisante et Purifiante de Nuit Sans Huile avec Aloe Vera, Armoise et Niacinamide, Crème Visage Végane Coréenne Hydratante pour Tous Types de Peau, 50 ml","26,00€",Cosmétique et Beauté,"4,6"
"Duo Collagen & Calcium, Soin Anti-Âge Contour des Yeux, Visage, Cou & Lèvres, Stick Hydratant & Crème, Cible Cernes et Rides (#1, 30g)","4,99€",Cosmétique et Beauté,N/A
Plaque décorative en bois « Beauty is an Attitude » - Citation inspirante d'Estée Lauder pour décoration murale - 12 cm x 18 cm,"19,49€",Cosmétique et Beauté,N/A
"Elizabeth Arden - Visible Difference - Crème de jour - Crème hydratante visage - Complexe Hydratant, Apaisant et Affinant - Soin Skincare Anti-Âge - Pour les peaux fatiguées","50,90€",Cosmétique et Beauté,"4,0"
"Coffret Double Action Réparatrice Éclat 24h : Sérum de Jour à la Vitamine C et Sérum de Nuit au Rétinol, 2 x 30 ml – Pour une peau éclatante, plus ferme et plus tonique, et une réduction","21,30€",Cosmétique et Beauté,N/A
Plaque décorative en métal « Beauty is an Attitude » - Citation inspirante d'Estée Lauder pour décoration murale - 30 cm x 40 cm,"22,94€",Cosmétique et Beauté,N/A
2 Pack DW Foundation Pump for Estee Lauder Double Wear Pump 30 ml Vacuum Pump Head Press Dedicated,"18,72€",Cosmétique et Beauté,"4,8"
Plaque décorative en métal « Beauty is an Attitude » - Citation inspirante de Estée Lauder pour décoration murale - 20 x 30 cm,"18,34€",Cosmétique et Beauté,N/A
Plaque décorative en métal « Beauty is an Attitude » - Citation inspirante d'Estée Lauder pour décoration murale - 20 cm x 30 cm,"20,64€",Cosmétique et Beauté,N/A
Plaque décorative en métal « Beauty is an Attitude » - Citation inspirante d'Estée Lauder pour décoration murale - 12 cm x 18 cm,"17,19€",Cosmétique et Beauté,N/A
Crema Contorno De Ojos - 15Ml,"26,88€",Cosmétique et Beauté,"5,0"
Pompe de fondation à remplacement en or pour la fondation Double Wear d'Estée Lauder,"9,99€",Cosmétique et Beauté,"4,6"
Royal & Langnickel Pink Essentials Smudger Synthétique,"12,40€",Cosmétique et Beauté,N/A
"Crème serrant pour les yeux, Crème anti-vieillissement pour les yeux pour réduire les sacs aux yeux, les rides, les lignes fines - hydratant et apaisant pour tous les types de peau","9,99€",Cosmétique et Beauté,"3,4"
"Lot de 2 Brosse de Contour Lymphatique pour le Visage, Brosse de Brossage à Sec, Masseur de Drainage Lymphatique pour Le Visage, Le Menton et la Mâchoire","12,99€",Cosmétique et Beauté,"4,2"
Beauty Glazed Antiadhésif 12 Couleurs Mat Rouge à Lèvres Nude Ensemble,"13,88€",Cosmétique et Beauté,"4,4"
Paula's Choice CALM Sérum Réparateur - Sérum Acide Hyaluronique Hydrate & Apaise les Rougeurs - Peaux Sujettes à la Rosacée - avec Acide Hyaluronique & Céramides - Tous Types de Peaux - 30 ml,"53,00€",Cosmétique et Beauté,"4,6"
Clinique Quickliner Stylo Dessin des Lèvres Longue Tenue | Non-Desséchant + Ne se Taille Pas,"20,99€",Cosmétique et Beauté,"4,5"
"Fond de teint anti-âge avec sérum anti-âge, maquillage, visage teinté à couverture transparente légère, correcteur hydratant de maquillage longue durée. (50ml)","8,89€",Cosmétique et Beauté,"3,2"
Diopticerne Fluide Éclaircissant Correcteur Cernes 15 Ml,"19,59€",Cosmétique et Beauté,"4,1"
"Power Lift Crème repulpante, anti-âge et fond de teint avancée avec ingrédients végétaliens, niacinamide + vitamine C + caféine","6,81€",Cosmétique et Beauté,"3,4"
Respectueuse Huile Solaire SPF30 100 ml,"28,50€",Cosmétique et Beauté,N/A
"Elizabeth Arden, Visible Brightening Gel-crème Booster d’Éclat, Crème visage Hydratante, Soin skincare Anti Taches brunes, Lissant","55,13€",Cosmétique et Beauté,"4,1"
couleur marron noir,"32,00€",Cosmétique et Beauté,"5,0"
"Crème - Hydratante, Utile Pour Réduire Les Ridules Et Les Rides, Tous Les Types De Peau","36,99€",Cosmétique et Beauté,N/A
"OULAC Rouge a Levre Hydratant, Rouge à Lèvres Rose Scintillant et Baume à Lèvres Pour Lèvres Sèches, Super Crémeux, Léger & Agréable Pour La Peau, Vegen (03) Pink Jewel","7,99€",Cosmétique et Beauté,"4,1"
Crème raffermissante pour les yeux à la caf,"8,95€",Cosmétique et Beauté,"4,2"
Soin Raffermissant Visage - 20ml Solution Hydratante Et Fermeté | Sérum De Nuit Visage | Pour Usage Voyage Spa À Domicile Massage Maquillage Jour Nuit Soin Saisonnier Automne,"5,94€",Cosmétique et Beauté,N/A
Contour des yeux au collagène 20 ml,"27,07€",Cosmétique et Beauté,"4,0"
"Base de précision pour rides et pores, teinte subtile","37,99€",Cosmétique et Beauté,N/A
"Luxeveria Ageless Serum Anti Ride - Hydratant Serum anti ride, Estaure 'Éclat Jeunesse, Visibles Du Vieillissemen, Pour Tous les Types de Peau (2pcs)","39,99€",Cosmétique et Beauté,N/A
"Correcteur liquide pour les yeux - 2,5 ml - Hydratant et éclaircissant - Concernant les cernes et les gonflements - Lisse les ridules Holdes","8,99€",Cosmétique et Beauté,"5,0"
"Elizabeth Arden, Vitamin C Ceramide Capsules, Sérum Visage Rénovateur d'Eclat, Soin pour le Visage Unifiant et Illuminant, Formule A base de Vitamine C et Céramides",N/A,Cosmétique et Beauté,"4,4"
"Baume bronzant anti-âge et graduel à l'acide hyaluronique – révolutionnaire 3 en 1 bronzage du visage, hydratant et raffermissant – Formule végan avec parfum ajouté de jojoba et de lavande (50ml)","20,99€",Cosmétique et Beauté,"4,2"
Coffret Routine Complète Visage & Corps Doré,"99,00€",Cosmétique et Beauté,N/A
"Facial Se Rum Formule Légère Et Soyeuse, 60 Ml, Liquide Hydratant Pour Le Visage, Sérums Raffermissants Pour Le Visage, Nutrition Et Protection, Pour Le Maquillage, Les Voyages, Le Jour, La Nuit, Les","5,39€",Cosmétique et Beauté,N/A
"Elizabeth Arden, Visible Brightening Capsules Sérum Correctrices Anti-taches Booster d’Éclat, Serum visage, Soin skincare anti taches brunes, Lisse le teint, Eclat","97,00€",Cosmétique et Beauté,"4,4"
Supreme Protección Muy Alta Spray Spf50+ 100 Ml,"37,21€",Cosmétique et Beauté,"4,0"
Shimmering Skin Perfector - # Topaz - 50 ml,"83,50€",Cosmétique et Beauté,N/A
"KLAPP Skin Boost Hyaluronic 5 x 2 ml, ml, 1, 100, 5 x 2 ml, n/a, 10","19,90€",Cosmétique et Beauté,"4,0"
Tresor Rare De Premier Traitement complet anti-âge pour la peau (concentré complet de la zone des yeux anti-âge) Idée cadeau d'anniversaire unique et coûteux pour homme et femme,"156,95€",Cosmétique et Beauté,"4,2"
"Pompe de Fondation,2 pièces Tête de Distribution de Rechange Ensemble de Pompe de Fondation en Plastique pour la Fondation Estee Lauder Double Wear","8,99€",Cosmétique et Beauté,"4,6"
"Elizabeth Arden - Coffret Lift Starter 3 Pièces, Advanced Ceramide Capsules Sérum, Advanced Ceramide Lift and Firm Crème Jour SPF 15 et Crème Contour des Yeux, Soins pour le Visage Format Voyage","35,00€",Cosmétique et Beauté,"2,0"
"Uriage Age Absolu Crème Anti-Rides - Rétinol, Acide Hyaluronique, Vitamine C & E - Booster Procollagène x6 - Rides, Relâchement - Volume & Hydratation - Velouté Eclat - Brevet Anti-âge Exclusif 50ml","39,33€",Cosmétique et Beauté,"4,5"
"Biotherm, Aquasource Total Eye Revitalizer, Gel Yeux Effet Froid, Hydratation & Éclat, Enrichi en Caféine & Vitamine C, Tous Types de Peau, 15 ml","23,31€",Cosmétique et Beauté,"4,3"
BIODERMA Créaline défensive sérum - Réduit rides et ridules - Agit contre l’inflamm’aging causé par les agressions extérieures - Pour un teint éclatant - Flacon 30 ml,"22,20€",Cosmétique et Beauté,"5,0"
"Set De Crème Essence Jour Et Nuit, Crème De Jour Pour Éclaircissement Et Hydratation Profonde, Crème De Nuit Anti-Rides Et Réparation Cutanée, Soin Complet Pour Une Peau Lumineuse Et Régénérée","11,99€",Cosmétique et Beauté,N/A
Pack spécial anti-âge de cellules souches,N/A,Cosmétique et Beauté,"4,0"
vetement femme solde HydraLuminous Skin Tint libérer teinté hydratant avec une formule hydratante légère à couverture légère maquillage Medium,"7,99€",Cosmétique et Beauté,N/A
Lait démaquillant 200 ml,"19,01€",Cosmétique et Beauté,"4,3"
AGE ELEMENT FIRMING BOOSTER PACK,"89,00€",Cosmétique et Beauté,N/A
"Elizabeth Arden, Advanced Ceramide Capsules, Sérum Contour des Yeux Rénovateur de Jeunesse, Soin pour le Visage, Soin Skincare Anti-Âge Quotidien","51,00€",Cosmétique et Beauté,"4,3"
"(démaquillant pour les yeux, 125 ml, 125 ml","12,92€",Cosmétique et Beauté,N/A
Elizabeth Arden,"20,35€",Cosmétique et Beauté,"4,3"
Soin Actif Hydratant,"164,44€",Cosmétique et Beauté,"4,5"
LETTRE DE COULEUR PURE CREAMY SANS ÉMALEMENT,"42,32€",Cosmétique et Beauté,N/A
"Perfecta Exclusive Diamond Rebuilding Réduisant les rides et les cernes crème pour les yeux et les paupières 70/80+, 15 ml","25,00€",Cosmétique et Beauté,N/A
Crème fermeté buste & corps - Elements 250 ML,"40,74€",Cosmétique et Beauté,N/A
"Magnetic Eyeliner,Magnetische Wimpern,Künstliche Magnetische Wimpern,Huile pour cheveux par Ouai","32,00€",Cosmétique et Beauté,"4,6"
"Yepoda The Night Light, Crème Hydratante Apaisante et Purifiante de Nuit Sans Huile avec Aloe Vera, Armoise et Niacinamide, Crème Visage Végane Coréenne Hydratante pour Tous Types de Peau, 50 ml","26,00€",Cosmétique et Beauté,"4,6"
"Elizabeth Arden Coffret Trio Rétinol + HPR, Ceramide Aqua-Crème Régénérante, Capsules Sérum Rétinol + HPR, Contour des Yeux Retinol, Cadeau femme, Soin hydratant, Anti-âge","35,00€",Cosmétique et Beauté,"4,7"
"Elizabeth Arden Prevage® Coffret La Puissance Anti-Âge, Soin du visage anti-âge et antioxydant, cadeau femme","223,00€",Cosmétique et Beauté,"4,4"
Couleur Caramel Volumateur Eye Mask 01 Extra Black,"35,00€",Cosmétique et Beauté,"3,7"
"Elizabeth Arden Advanced Ceramide Capsules, Coffret Solutions Rénovatrices de Jeunesse Liftantes & Raffermissantes, 3 Pièces","89,90€",Cosmétique et Beauté,"4,3"
Christian Laurent Botulin Revolution Crème de jour et de nuit anti-rides pour le visage pour peaux matures pour femme 50 ml Crème hydratante Botulin Revolution pour le visage Lifter Réduit les rides,"17,89€",Cosmétique et Beauté,"3,9"
crème de jour et crème de nuit pour un traitement complet anti-âge en offre combinée,"88,00€",Cosmétique et Beauté,N/A
Gel contour des yeux anti-âge Rosa Damascena,"6,51€",Cosmétique et Beauté,"4,8"
"Elizabeth Arden Hyaluronique Ceramide Capsules, Coffret Repulper en un Seul Geste, Soin Hydratant et Repulpant, Cadeau pour femme","97,00€",Cosmétique et Beauté,"4,2"
"Elizabeth Arden Ceramide Premiere, Crème Hydratante Visage, Soin pour le Visage Régénérant, Skincare Hydratation Intense, Indice de Protection Solaire SPF 30, 50 ml","73,50€",Cosmétique et Beauté,"4,6"
Gel contour des yeux anti-rides Intense Definition - Collagène marin - Soivre - 30 ml,"23,90€",Cosmétique et Beauté,N/A
Baume hydratant et rafraîchissant pour les yeux - 6 g.,"12,67€",Cosmétique et Beauté,"4,2"
Crème exfoliante pour le visage Diamond Rose 75 ml,N/A,Cosmétique et Beauté,"2,6"
"Crème Visage Anti-Rides à l’Or Naturel – Soin Précieux Régénérant, Hydratant et Nourrissant pour une Peau Lisse et Lumineuse, 50 ml","25,01€",Cosmétique et Beauté,"4,8"
Paula's Choice CALM Sérum Réparateur - Sérum Acide Hyaluronique Hydrate & Apaise les Rougeurs - Peaux Sujettes à la Rosacée - avec Acide Hyaluronique & Céramides - Tous Types de Peaux - 30 ml,"53,00€",Cosmétique et Beauté,"4,6"
"Uriage Roseliane Crème Riche Anti-Rougeurs - Beurre de Karité, Extraits de Ginseng et Algues - Apaise, Hydrate, Atténue les Rougeurs - Confort Durable - Peau Sèche et Sensible - Non Comédogène - 50ml","13,60€",Cosmétique et Beauté,"4,2"
"M. Asam MAGIC CARE 10% Peptide Solution Serum (30ml) - Serum Visage Au Peptide Pour Skincare Anti Rides Puissant Immediat, Soin Visage Lissant Et Raffermissant Pour Tous Types De Peau","29,99€",Cosmétique et Beauté,"4,6"
"Crème serrant pour les yeux, Crème anti-vieillissement pour les yeux pour réduire les sacs aux yeux, les rides, les lignes fines - hydratant et apaisant pour tous les types de peau","9,99€",Cosmétique et Beauté,"3,4"
"promesse Nettoyant quotidien pour le visage, doux, moussant et anti-âge.",N/A,Cosmétique et Beauté,"3,9"
"Notre sérum Caviar au Silicium Organique. Repulpant et dynamisant Donne de l’éclat à la peau Grâce à sa richesse en principes actifs, il redonne éclat et jeunesse à la peau.","40,00€",Cosmétique et Beauté,N/A
CELLULAIRE 200ml exfoliant essentiel,"14,99€",Cosmétique et Beauté,"4,3"
Masque Yeux Cristal Collagen Anti-âge Effet immédiat,N/A,Cosmétique et Beauté,"3,9"
"Crème hydratante intensive, peau très sèche & sensible, crème de jour légère sous maquillage, lot de 2 pièces","9,99€",Cosmétique et Beauté,N/A
"Christian Laurent Crème contour des yeux anti-âge - 30 ml - Sérum raffermissant anti-âge pour le visage, le front et la bouche - Réduit les cernes pour les femmes - Effet anti-rides - Crème","17,92€",Cosmétique et Beauté,"4,4"
